{"compiler":{"digest":"aaaaaaaaaaaaaaaaaaaaaaaaaaaaaaaaaaaaaaaaaaaaaaaaaaaaaaaaaaaaaaaa","id":"pllm/compiler","version":"0.17.0-alpha.1"},"components":[{"digest":"cccccccccccccccccccccccccccccccccccccccccccccccccccccccccccccccc","id":"core-wrap32","version":"1"},{"digest":"bbbbbbbbbbbbbbbbbbbbbbbbbbbbbbbbbbbbbbbbbbbbbbbbbbbbbbbbbbbbbbbb","id":"masked-linear","version":"1"}],"configuration_digest":"43cb9fa05e87d1fe88daf1d2573b42bc0794b84e505c90be07d3c647816cea32","evidence_references":[{"digest":"75618d145fe93a7ecdd56bcb7e53a64eb4904ace2d0915946823d8c5b87376ef","id":"assurance.composition"}],"execution_plan_digest":"768546d8d9ef3420ba13a02887251e6172e6d608ca1b84ede26248472f28a035","logical_plan_digest":"ccb6dc4466602d04fd5097f4b0a49aa555de876e4e99427eed7816a67b2a6df1","model_digest":"1111111111111111111111111111111111111111111111111111111111111111","numeric_graph_digest":"f21bdf63a267cae97ee0044be6d2c4cacea453ded2a6ac4ca93b2dfaa7206fe7","privacy_contract_digest":"5367e147dcd6d2d8b7d921a2f62fb7aa99f72321048ff906f945129517e0353b","schema_version":"pllm.plan_lock.v1","tokenizer_digest":"2222222222222222222222222222222222222222222222222222222222222222","workload_digest":"6666666666666666666666666666666666666666666666666666666666666666"}
